País;Codigo Legenda;Texto
Inglaterra;*ing_cyber *legenda_91;no means no. it does not mean convince me. here is a collection of stories people have sent in recently about trying and fend off the unwanted advances of men, and when that goes wrong. here also, are some questions I would like to ask: why do you need a reason to leave me alone? why do we have to pretend to have a boyfriend for you to get the message? why can you not accept that I am not interested, not because I am taken, but because I am not interested? and also, why do I have to be someone else property for my position to be made clear? ⠀
Inglaterra;*ing_cyber *legenda_92;everyday is a great day to be an active_bystander !! today I want to talk about bystander_intervention and share a post illustrated. when we talk about bystander_intervention, we often think of the most extreme version of this, something like a citizens arrest. but it does not have to always be that confrontational, in fact there are many ways you can show up for and advocate for a person who is being harassed. when it comes to some of these ways, you might hear people refer to the 5 ds. those are known as: direct, delegate, delay, distract, document. while some of the ones illustrated in this post are slightly different, the majority of the messaging is the same. however, I would like to caveat that I probably would not engage or encourage the 3rd option if you are a woman or marginalised person, this is probably something in my opinion, that only a person who holds a certain amount of privilege and has done an extensive risk assessment could get away with, even then it is definitely most risky option! I would be interested to hear others thoughts on this below. these directions are supposed to show you options for how you can engage, sometimes it is as little as asking someone if they are okay. remember, when doing so please be safe and consider the safety of others around you. however doing something, is better than doing nothing.
Inglaterra;*ing_cyber *legenda_93;when you tell people you are getting divorced at 31, the questions come thick and fast. why did you go through with it? did something awful happen? was he emotionally_abusive ? did you meet someone else? people want to pinpoint exactly what went wrong, maybe so they can scan their own horizons for red_flag. but the truth is, my husband was not awful, and neither was my relationship. it just was not enough. saying that out loud was like coming up for air.⁠ in our latest issue, content creator and campaigner Sasha Pallari tells stylist why getting divorced is the bravest thing she has ever done.
Inglaterra;*ing_cyber *legenda_94;when Anna was 33, she found out that her husband of two years was cheating on her. at first, the reason behind the breakdown of her marriage made her feel ashamed, but as divorce proceedings got underway, that shame gave way to anger. she was determined that people should know exactly what had happened. I told everyone what type of person he is, she says. he was an arse and the world should know what he did. Annas unapologetically combative approach stands in stark opposition to the picture of divorce that has often been painted by celebrities and non famous folk alike over the last decade. throughout the 2010s and into the 2020s, there has been a pervasive social expectation that, if couples can not do until death do us part, they should at the very least end things amicably. ⁠in an age of conscious uncoupling, a messy divorce can be frowned upon but what if there is something to be gained from releasing your rage?
Inglaterra;*ing_cyber *legenda_95;if you put a time limit on love you risk choosing the wrong person just because you feel like it is time. you risk forcing yourself into a role that might not feel right with a person who might be wrong for you. I do not believe in the one, that is romcom nonsense just training women to put up with shitty behaviour from men. life is long and complicated, feeling pressure that you are running out of time to find love will only make you unhappy. some people find love young, some people find it old, some people find love once, some people find it many times over, some people are happy single. one thing is for sure, at 27 you have a lifetime left to find love in many ways and many places.
Inglaterra;*ing_cyber *legenda_96;2023 was a big year for women in film, but you would not think so by taking a glance at some of hollywoods biggest awards shortlists. ⁠Sofia Coppola gave us a glimpse into the world of Priscilla Presley in priscilla, Emerald Fennell returned to our screens with the popular but divisive saltburn, Celine Song made her directorial debut with past lives and we have not even mentioned the behemoth that was Greta Gerwigs barbie.⁠ however, as awards season rolls on, female directors continue to be snubbed. and today, arguably the biggest and most respected awards ceremony in hollywood unveiled its nominations for 2024, and again, one woman is featured in the best director shortlist.
Inglaterra;*ing_cyber *legenda_97;a new study by young womens trust has revealed that gender_based discrimination in the workplace is on the rise.⁠ the charitys annual survey of 4,000 women aged 18 to 30 found that 50_percent have experienced discrimination at work, a jump from 42_percent last year. worse still, 25_percent are suffering in silence, feeling unable to challenge the sexist_comments, dismissive behaviour and financial_inequality they are facing day in, day out.
Inglaterra;*ing_cyber *legenda_98;for female surgeons, sexual_assault is distressingly routine. as a report published in the british journal of surgery recently showed, almost one in three of those working in the national health service has been sexually_assaulted in the past five years, including 11 instances of rape. nearly 90_percent of those surveyed said they had witnessed sexual_misconduct, over a third had been on the receiving end of sexual_banter, and 29_percent had experienced unwanted_physical_advances.⁠ revealing these grim statistics has been called surgerys the hashtag me_too moment. stylist speaks to female surgeons about their experiences, and how important it is for things to change.
Inglaterra;*ing_cyber *legenda_99;do you remember when we told women to fight sexism in the workplace with power poses? that ted talk has thankfully had its moment, but there are still variations on this that get repeated, girlboss tips telling women to not say just, to take ! out of their emails, to dress in a certain way, or speak a certain way. they are told to speak up and learn in! these tips claim to give women confidence and help them progess in their careers, and maybe for some individual women, they will be helpful. but, these tips are more likely to be at best useless and, at worst harmful. research shows that women who are seen as too assertive or not assertive enough are punished in the workplace. women have to trend a fine line between the two, an impossible task.  because women changing the behaviour can not fix an inequal_system. research shows that women are just as likely as men to ask for higher salaries, and men and women are equally likely to report avoiding negotiations if they feared it would hurt their relationship with their boss. but women are less like to get those raises when they ask. why do we think that is? devaluing feminine traits like being friendly, speaking softly, or standing in a particular way is not helpful in the long run. blaming womens lack of confidence or lack of assertiveness on why they are not in leadership is victim_blaming . individual women are up against systemic inequality and misogyny. that is why there are not enough women in leadership positions, that is why women are underpaid and overlooked. the only solution is a reimaging of power and leadership as a position for any gender and where feminine_behaviours are seen as just as valuable as masculine ones, think Jacinda Ardern. fix the system, not the women.
Inglaterra;*ing_cyber *legenda_100;⁣I rediscovered this video yesterday and the shameless outward and internalised_misogyny is rife. this  video is from two years ago, but it does not age well. in this video Kelsey Beth Crossley calmly and gently explains why she does not enjoy being told to smile by strange men on the tube, and she is interrupted about 10 times by both Andy West and the presenters. it is almost painful to rewatch. I was asked to comment on this at the time, because my work was credited in the byline of the piece. so I wrote an article for the i news about my feelings. I had never written an article before so I was extremely nervous about getting the words out, but if you are passionate and ahem angry enough, it just comes to you. I urge you to watch this video all the way through and see what we are dealing with here. I can not decide what my favourite line is, it is either feminist idiots or but have you tried being a man on twitter. gosh it is so hard. really hard.⠀
Inglaterra;*ing_cyber *legenda_101;‼️ important !! sexual_harassment has a severe impact on women and marginalised genders mental_health. it causes anxiety, depression, trauma, and dictates how we make hundreds of tiny decisions throughout the entire day. it impacts every part of our lives, and it makes those tiny, what should be mundane, decisions feel huge. but when the thing causing this anxiety is your boss? not only that, but someone you live in a close proximity too? and your complaints or concerns are being ignored? I can not imagine how destructive and isolating the impact of that would have been. the harassment Jaysley Beck endured from her army boss should not under any circumstances be downplayed as a factor in what happened to her. and nor should the accountability of the army, these things do not happen in a vacuum. they happen because some men can and will abuse their positions of power. they happen because of patriarchy. they happen because of misogyny going unchecked, ignored and unchallenged. they happen because they have been allowed to happen. and what about women? well, women have been forced and socialised to make sure men do not feel rejected. to keep men happy. not wound their fragile egos. constantly appease and be polite as to not appear rude, for fear of repercussions. so we do not get treated aggressively. so we do not upset them. so we do not get called frigid. so we do not make a scene or cause a fuss. so we do not get killed. because an insecure man with a wounded ego can be a very dangerous thing. because we have been told that we are responsible for for mens feelings and actions. it is fucking exhausting. and it is fucking unfair. harassment ruins lives. it ruins opportunities for women and marginalised groups. it makes your world smaller. it has real life consequences, and it is fundamentally a symptom and an aggravating factor of gender_inequality. we will never be equal until we feel safe. rip Jaysley. sending so much support to your family and friends this should not have happened.
Inglaterra;*ing_cyber *legenda_102;did you know almost 2 to 3 women have been sexually_harassed at work? well, if you follow this page, you are probably not that surprised. a new study from the trades union congress has revealed that 2 to 3 women experience harassment, bullying or verbal_abuse at work and that most victims do not report for fear of not being believed, or wanting to damage future career prospects or work relationships. I am sorry, the hashtag me_too has gone too far. what?? just no! we have always needed more than just a hashtag or infographic to create meaningful actionable change, and make women and marginalised folk feel safer in public spaces, but these statistics are so depressing! it has been 5 years since metoo, and we are still living in a time where women are scared to speak out about being harassed for fear of losing their jobs. has much progress really been made? perhaps the awareness around me_too has meant more people can recognise acts of harassment for what they are, but has the culture on a whole changed enough? if looking at the business sector in this country is anything to go by, the recent allegations against the confederation of british industry really say it all. I had a look into the prevalence of workplace harassment when doing my photo series front line harassment, speaking to key workers during the time of the pandemic about their experiences being harassed at work. this was at a time where we were all clapping for carers and national health service workers, when at the same government was giving out pitiful pay rises. it sparked a huge conversation around workplace safety, harassment claims and how little women are appreciated in key worker roles. we know it is not just frontline workers who experience daily harassment, it is everyone else apparently too. or as the survey points out 62_percent of women age 25 to 34. these figures are unacceptable in a modern functioning society. women and people of marginalised genders will never truly be equal to men if we are constantly being tormented in our place of work, alongside all the other forms of discrimination we already face. how many more years is it going to take?
Inglaterra;*ing_cyber *legenda_103;what do you think is a parents and a mothers responsibility when they have a son who is exhibiting abusive_behaviors ? I am always hesitate to talk about mothers when discussing abusive_men because it so quickly becomes how can we find a woman to blame? but equally teaching young boys, as a society, not just as parents, about respect, empathy and emotional regulation, is the key to the creation of men who have healthy_relationships . also after watching George convince all the other contestants and the experts, it is satisfying to see that his mum has him figured out. well mostly I would not say overprotective personally.
Inglaterra;*ing_cyber *legenda_104;I love watching women on tv support each other and hold their male family members to account. shake needed to hear this, for his own future happiness as well as Deeptis. i think part of love is telling people the truth. i am also glad she did not do what other people have done when Shake has asked for advice, which is dismiss the importance of sexual attraction. i do find it interesting that the mothers are always the ones taking the lead in these meet the parents shows. mothers are presumed to be the ones to take on the emotional_labour of discussing their childrens feelings with them, to be the most interested in their children getting married and to hold the keys to the fiancé entering the family.
Inglaterra;*ing_cyber *legenda_105;I find it interesting when cis men talk about wanting large families, especially single men. they very rarely acknowledge that they are talking about a woman they have not even met yet risking her life and her health to achieve this dream of his. men who have this dream are very unlikely to take on the burden of labour of a large family after the birth either. over the past half century, fathers in usa nearly tripled their child care time from 2.5 hours per week in 1965 to seven hours per week in 2011. But, over this period, womens parenting time too has increased, from 10 hours per week in 1965 to 14 hours per week in 2011. this pattern repeats in the united_kingdom. when considering time spent in child care plus time spent in housework and working for pay, the birth of a baby increased mothers  total workload by 21 hours per week. in contrast, fathers total workload increased by only 12.5 hours per week. this represents a 70_percent greater increase in workload for women compared to men. these differences cannot be explained away by differences in paid work hours or breastfeeding. with this in mind a man wanting a large family is not the same as a woman wanting one
Inglaterra;*ing_cyber *legenda_106;It is hard to pinpoint exactly what the worst part of these cards are…I am torn between: the gross patriarchal  sexist messaging this sends to young boys about their sisters and mothers place in the world. the perpetuating of misogynistic tropes and harmful stereotypes about women, daughters and wives. overtones of normalising coercive_control and da.  and the depressing reality that these photoshoots were if not organised by, were signed off, approved and thought to be harmless holiday fun the woman in the family. any more to add to the list???
Inglaterra;*ing_cyber *legenda_107;you might be asked to give a presentation, go to a business dinner, or attend an event specifically because they need more women. always laugh off this complete insult to your worth as a human being and never make a big deal about it. for more hilarious tips from Sarah Cooper on how to make it as woman in a male_dominated workplace.
Inglaterra;*ing_cyber *legenda_108;by this time next week, the average full time female employee in the united_kingdom stops earning for the year compared to the average full time man. help stylist raise awareness of the gender_pay_gap .
Inglaterra;*ing_cyber *legenda_109;If there is ever been a reminder that we need to fight for, and protect, our rights as women, surely it is today. women in the united_kingdom are still paid significantly less than men, and tomorrow marks the point in the year when the average woman in full time work effectively stops earning. And so in recognition of the united_kingdom 18.1_percent gender_pay_gap, we will be leaving work 18_percent early.
Inglaterra;*ing_cyber *legenda_110;the message is clear: womens acceptance into the business world is conditional on them looking and dressing a certain way. these women are expected to wear painful high heels, uncomfortable clothes, spend hours on their hair and makeup, as well as a lot of money, only then will lord sugar and his associates listen to their business plans. And do not pretend that this is nott gendered just because the men wear suits: it takes five minutes to put a suit on. the all female semi final introduction could have gone so many ways, and they choose this way, how regressive.
Inglaterra;*ing_cyber *legenda_111;throughout history, people, particularly women, from the upper classes would showcase their wealth through uncomfortable fashions, for example, heavy fabrics, items you need someone else to help you put on, or fashions that restrict your movement and therefore ability to work. anything that makes it harder to work, showcases that you don not need to work, you are too wealthy for that. especially for women, where class is a larger factor than men in how much work they were expected to perform. a lower class woman would have to earn money for the household as well as perform domestic_labour, a higher class woman could have servants or slaves perform domestic_labour and her restricted freedom would make her a trophy of her husbands wealth. in modern usa, the top 20_percent of americans owned 86_percent of the countrys wealth and the bottom 80_percent of the population owned 14_percent. americans have the highest financial_inequality  in the rich world and over the past 20 30 years americans have also experienced the greatest increase in financial_inequality  among rich nations. on selling sunset, they throw around numbers like 20 million without batting an eyelid, they are part of the wealthy elite created by hypercapitalism. no wonder they act like Marie Antoinette.
Inglaterra;*ing_cyber *legenda_112;gender_pay equality is about respect for women, not  just  money. financial_inequality is a form of violence that hurts women everyday.
Inglaterra;*ing_cyber *legenda_113;in the united_kingdom, 64_percent of undergraduates in the arts are women, but 68_percent of the artists represented at top london commercial galleries are men? this is one of the reasons why I teamed up with Bee illustrates to set up grassroots, feminist charity exhibition that platforms women and marginalised genders using their practice to call for change called: hysterical. hysterical is an annual art exhibition and series of creative events celebrating the artwork of marginalised creatives, which fundraises for charity each year. after the success of our first fundraiser in 2023, hysterical social club is returning bigger and better than ever with an evening of talks, workshops, art, and the opportunity to connect and network with our creative community. there will be a questions and answers session with Bee Illustrates and Eliza Hatch, performances, variety of artworks, crafts and stalls, make your own friendship bracelets, and even queer match making. guests will receive a free goody bag, so make sure you get down early to nab yours!
Inglaterra;*ing_cyber *legenda_114;did you know that on any given day in 2021, there were 132,000 individuals living in modern slavery in the united arab emirates? earlier this week I visited a new exhibition in soho highlighting stories from women survivors of human trafficking. the exhibition provides a platform for important stories to be heard, featuring real testimonies from nigerian, ghanaian and kenyan women who were misled with the promise of well paid jobs in dubai, and instead forced into sex work. their passports are often confiscated by their traffickers, and the women are told that to regain their travel documents and their freedom, they must pay their employer huge sums.the exhibition is organised by send them home, a campaign group helping to repatriate nigerian women trafficked to the united arab emirates, working with the nigerian national agency for the prohibition of trafficking in persons and hope education project, a pilot education programme in ghana tackling human trafficking at its source. you can help raise awareness to stop human trafficking by: Sharing this video. Visiting the exhibition to learn more about the survivors stories. visit the exhibition.
Inglaterra;*ing_cyber *legenda_115;happy galentines day to all my gals! female friendship is bloody force to be reckoned with. It is the driving energy of feminism. fothing beats the feelings of solidarity with other women, of late nights debating, learning and laughing together, of telling other women your deepest thoughts, feelings and fears and having them say: I thought I was the only one. so no matter how you plan to spend the 14th February, take a moment on the 13th to tell your gals how much you love and appreciate them
Inglaterra;*ing_cyber *legenda_116;to all the survivors out there…when it feels like no one is listening. when it feels like we are going back in time. when you are not being believed. when it feels like no one cares or like you are the only one feeling this way…you are not alone
Inglaterra;*ing_cyber *legenda_117;is anyone else watch the news and doomscrolling in a state of despair? or is that just me...? Every time I look at my phone things seem to be ramping up to new levels of chaos and government incompetence...and it is all starting to feel a bit much. i have seen a lot of people posting things like,  it is just one christmas it is fine and things will be better next year which is all well and good, and, hopefully, true for some people. but I also think it is important to allow yourself to have all the feelings, to sit in this moment and give yourself a break. it is okay to feel sad right now, to feel overwhelmed, to feel let down by our government, to feel angry and conflicted about everything going on. things will get better eventually, and not feel so doom and gloomy. that is something we can all look forward to for sure. but if you are having a hard time looking a bit further down the line, you are not alone. If you are not feeling super festive at the moment, that is very understandable. and If you need to lie under a blanket for a few days and hide from the world, i think we all need that too. ⠀
Inglaterra;*ing_cyber *legenda_118;goodbye and good riddance 2020 . usually at this time of year I would post a roundup of highlights and achievements, but just getting though this year alone has been an achievement in itself!! to everyone seeing other peoples highlight reels, and not feeling so chuffed about their own year. your not alone. i personally find this time of year tricky anyway, and can sometimes find myself falling into social_media comparison holes, doubting myself or worrying that i have not done enough. however this year, I am not doing that. no. this year I am just happy to be here,and grateful for the people in my life, despite all the ups and downs we have had in 2020. I am aware of how eye wateringly cheesy this all sounds, but I do not care. i am looking forward to next year. to whatever happens, even though there is still so much uncertainty, and at this particular moment in time, things are feeling stranger than ever. but as this year is closing out, I am sure we can all feel a little relief. fingers crossed 2021 is less of a shit show....
Inglaterra;*ing_cyber *legenda_119;Women building other women up. What is not to love?
