País;Codigo Legenda;Texto
Inglaterra;*ing_cyber *legenda_1;not only are we socialised from childhood to make ourselves smaller and other peoples lives easier, even the culture around us demonises characters who impose their desires on others. in romcoms, in particular, being a confident, direct woman is vilified, whether it is the forthright book editor Margaret Tate, played by Sandra Bullock, in the proposal or Sharpay Evans, portrayed by Ashley Tisdale, the sparkly pink diva in high school musical. for years, Amy Beecham, a stylist, was taught that the ultimate goal was being down to earth and low maintenance was the ultimate goal. now, she is discovering that being high maintenance is not the toxic trait we have been told it is.
Inglaterra;*ing_cyber *legenda_2;they call me picky and modern. at one point, i was even told by an aunt to just take the next one that comes. author Shubnumkhan has spent a lifetime fielding questions about why she does not have a partner. it is taught her that society is still uncomfortable with the idea of a woman being single and happy, she writes. ⁠
Inglaterra;*ing_cyber *legenda_3;the number of women attending football matches in the united_kingdom continues to grow, at some games, women make up 25_percent of spectators, but can feel underrepresented and marginalised. this video piece profiles this fan girl,  a community empowering female football fans by capturing the faces, voices, stories and opinions of women who love the beautiful game
Inglaterra;*ing_cyber *legenda_4;the, i go to work and you stay_at_home agreement, is a sham if even when the paid work stop, you are still expected to do all the domestic and reproductive_labour, for six children! men know in their hearts that even getting punch in the head is easier than this and more rewarding. otherwise, more men would be eager to be house husbands.
Inglaterra;*ing_cyber *legenda_5;there is a view that women have less value as they age, while older men become more attractive. in particular, misogynist corners of the internet, there is a myth that women hid the wall at 30 and just completely shrivel up. love island shows that the ridiculous idea that 30 is somehow old has filtered into the mainstream. if you think of the women in your lives, we all look pretty similar at 25, 30, and 35, not much changes! and even when we do change and age, so what, the patriarchy wants women to see aging as a personal failure, instead of a natural process, literal proof of a life lived. to see 30 as the sword of damocles, the absolute thing to fear. the women hitting the wall at thirty propaganda is, of course, a complete fairytale. it is a lie propagated to comfort the bitter men. they want to scare women into settling for whatever relationship they are in in their 20s. to settle for less. they want women to think that they are less worthy in their 30s and 40s, which also just so happen to be the ages when they are growing in confidence, financial security, experience, and wisdom. at the same time, men like to convince themselves that they are much more worthy as they age, so of course it is totally fine and not creepy when they are 50 years old hitting on women in their 20s. as women age, they become more themselves and take up more space, and that terrifies some men.
Inglaterra;*ing_cyber *legenda_6;happy women history month! throughout history, discoveries, inventions made by women have been overlooked or completely disregarded, by both the men who took credit for them and those who wrote the history books. when you consider the barriers and oppression these women had to overcome to gain the education, resources, time and access to the equipment needed for these discoveries, these omissions are even more egregious. the idea of one man revolutionising history through his special genius is a false narrative, created by men who wish to paint themselves that way. the story of discoveries and intervention is more often than not one of teams, teams building on the work of people that have gone before them, teams that include women, and benefit from the labour and work of women. also sometimes men just straight steal the work of women, they get away with it because the structural power is on their side. so let us give these incredible women to long overdue credit they deserve. even if we can not give them the nobels they deserve
Inglaterra;*ing_cyber *legenda_7;when i was growing up, i felt excluded from skateparks and football pitches and traditionally male outdoor areas. when my friends and i went to the skatepark, we were told to leave on multiple occasions by boys. after a while we just stopped showing up. a recent study by the royal institute of british architects highlighted research that found 80_percent of the people who use outdoor spaces and equipment for young people are male. academics from the department of educational studies at goldsmiths university, gave evidence to the inquiry and said girls are not given the access to community spaces that boys are. and added that they feel they do not have a right to use skateparks, while often equipment is built with the default male user in mind, so the height of equipment is often set too high. i am learning how to skate in my late 20, and even i find this is still the case. i am trying to reclaim some of those spaces, and have been learning to skate for about a year and a half now. while things are definitely changing for the better, it seems they are not changing quickly enough. public space, and recreational spaces should be equal and accessible to all. it is incredibly sad that in 2024 girls still feel that they do not have access or are able to be in these spaces. these studies are also rarely inclusive of the experiences of gender non conforming and trans kids, who surely have an even tougher barriers to accessing these spaces. the charity make space for girls is trying to address and change this, but we need more investment funding and urgency into democratising and creating spaces that are not restricted by gender.
Inglaterra;*ing_cyber *legenda_8;if yesterday has highlighted anything, it is the grim reality of how dangerous male entitlement can be. the root cause of this is misogyny. it is patriarchy. it is sexism repackaged as being a better or real man, by toxic social_media influencers. it is social_media companies themselves allowing this content to be eaten up, unchallenged. it is an entire society that turns a blind eye to the cause of violence towards women and girls. none of these problems are new, they have just repeatedly been left to fester, morph and grow until we are at a place where a high profile public figure can come on live tv and make misogynistic remarks about a woman, and the next day lament the death of a 15 year old girl by a boy, and not see how those actions are connected. misogyny breeds violence. it is never just a comment, banter, a joke, it is a culture that enables women to be seen as less than men. as disposable, without agency. we did not need to have this horrific wake up call. it should not  take the violent death of a teenage girl for society to listen. misogyny should be treated with the same severity as any other form of terror and violence. this is not something women should have to put up with anymore.
Inglaterra;*ing_cyber *legenda_9;i had just started working as an administrator for a car dealership. as you can imagine, it was 90_percent male and lad culture was rife. the daily remarks on my appearance ranged from run of the mill compliments, for example, you look nice to the graphic, that is, speculating about how i would be in bed, commenting on my figure in lewd detail, in short they began to wear thin very quickly. one day, i was on my lunch break and stood outside in the staff car park which was in the back. i was on the phone to my boyfriend, pacing between two cars as we chatted and then i paused to rest. out of nowhere, i felt an aggressive squeeze on my bum, i turned around and one of the drivers, who was weeks away from his retirement, just smiled and winked at me. i was so shocked that the only words i could seem to say were i am on the phone to my boyfriend! he walked off to the garage without a word or an apology. i reported it to my line manager straight away, he told me this would get really ugly for me and advised me to let it go. his boss, who was on holiday when the incident took place, told me he had expected me to have a sense of humour about the whole thing and said do not be so dramatic. i quit the next day.
Inglaterra;*ing_cyber *legenda_10;in 2023, a year that has already brought to light so many horrific abuses of women and girls, we have now been served yet another reminder that there are still people out there who refuse to treat us with basic respect and dignity.⁠ following a now viral on air misogynistic rant, controversial gb news presenter and political activist Laurence Fox has been formally suspended by the channel after he refused to apologise for asking who would want to shag that? about a female journalist live on air.⁠ this kind of casual misogyny is not  just repulsive playground talk. according to Amy Beecham from stylist, this poses a serious threat to the safety of women. why is it that i would not sleep with you is still considered the ultimate insult for women?
Inglaterra;*ing_cyber *legenda_11;for most couples, date night is something to look forward to, but just over a year into my relationship with my ex partner, the prospect filled me with dread. i knew that once we would finished getting ready for a night out together, i would be greeted by a sullen face and endless shaming comments about my fashion and beauty choices, which he insisted were designed to command attention from other men. Jonah Hill and Darius Daulton Jackson have come under scrutiny for allegedly trying to control how their female partners present themselves.
Inglaterra;*ing_cyber *legenda_12;Brinta Ponnuthurai, known online as Brynta Ponn, has racked up more than 100,000 followers on Instagram thanks to her message of body_confidence, but that self_esteem was not always present. growing up as a south asian girl in toronto, canada, she faced judgment for her skin, which led to her experiencing deep hatred and resentment towards her appearance. through a process of unlearning the toxic messages we are told about our skin, practising gentleness and refusing to hide away, she worked her way from self hatred to absolute self love.⁠ we chatted with the influencer about her journey to skin freedom.
Inglaterra;*ing_cyber *legenda_13;why are women expected to dress sexy while men are not? because how we understand sexy in our culture is all about the male_gaze. in a patriarchal culture, failing to meet the male_gaze, demonstrating sexual agency as a woman, or not conforming to a narrow set of beauty standards are all met with sexist backlash. the sucess of women under the patriarchy is tied to how fuckable they are. woman can not simply opt out of this, no matter what choices individual women make about the way they dress or behave, the choices of women choices would still be limited by the desires of men. the way that women conduct themselves in a sexist society, even when problematic, is not worth critically analyzing without attention to the wider context of the patriarchical system we are trying to survive and thrive within.
Inglaterra;*ing_cyber *legenda_14;our society values physical attractiveness, but our cultural construction of femininity places a premium on beauty and body size, as an integral aspect of what is valuable.
Inglaterra;*ing_cyber *legenda_15;too fat. too thin. too tall. too small. too pale. too dark. too old. too wrinkly. too big. too little. too hairy. is not it all exhausting? imagine pouring all the energy it takes to hate yourself into creating some peace for yourself. imagine using that energy to change the world. not sure how long it will late but for now let us take a break.
Inglaterra;*ing_cyber *legenda_16;another week, another case of men publicly prescribing and shaming female sexuality. by now i am sure most of you would have seen or heard about the single wap  by Cardi B and Megan Thee Stallion, and probably the predictable backlash and distress it seems to have caused many cis straight men. funny how when a man talks about and sexualises a woman, it is ok, it is hot, it is  what we are programmed to see. but when a woman starts owning and reclaiming her sexuality, her body, and shock horror. talking in a sexual way, it is suddenly shameless and disappointing on a personal and moral level. why do we hold women in the media and popular culture to different standards than men? and also who the fuck cares. i am bored of the male_gaze, and i am wholly here for the roles reversing. from Ben Shapiro citing misinformation about the hygiene of women to Russel Brand mansplaining feminism, it shows how we are still very much living to the double standards and pitfalls of the patriarchy.⠀
Inglaterra;*ing_cyber *legenda_17;no matter what you think about this kind of advertising, the bottom line is that there is a very blatant double standard in the censorship of fka twigs. the body of women, and specifically the colour bodies of women have been over sexualised and hyper sexualised for centuries. meaning that nudity equals sex or in this case? equals serious offence. there is a clear double standard here, with it is roots in sexism and racism
Inglaterra;*ing_cyber *legenda_18;do you ever feel like no matter what you do, you are being sexualised? whatever you wear, whatever your job is, whatever you eat, you drink, however you live your life as a woman or marginalised person, it can be twisted a certain way? well, you are not alone.
Inglaterra;*ing_cyber *legenda_19;last week, the Angiolini inquiry report into the circumstances that led to the murder of Sarah Everard,  was published, concluding that Wayne Couzens should never have been a police officer, as her family insisted that Sarah died because he was a police officer, she would never have got into a car of a stranger.⁠ now, the new documentary of bbc Sarah Everard: the search for justice, made in close collaboration with the Everard family, delves deeper into investigating her murder by the metropolitan police, looking at how this devastating crime unfolded and the impact that was felt across the country.⁠ Amy Beecham, writes how the documentary, is a harrowing but important reflection on the extent of violence_against_women and girls in our society.
Inglaterra;*ing_cyber *legenda_20;according to domestic_abuse charity refuge, one in three united_kingdom women have experienced online abuse or harassment. currently, the online safety bill, which includes protections against cyberflashing and deepfakes, is on its way through parliament in a bid to change the murky laws around the way perpetrators can be prosecuted for digital crimes.⁠ in her new bbc documentary asking for it? actor and comedian Emily Atack reveals her own experience of online sexual_harassment, which ranges from explicit images to rape threats, all while wrestling with the harmful internal narrative that it is somehow her fault. ⁠i noticed, particularly in lockdown, that there was a huge rise in the amount of dick pics i was being sent, she says. my whole life i have kind of struggled with male_behaviour towards me, but this was something even more intense. when i am being sent videos and sexually_violent language, i am being sexually_harassed every single day of my life, at home, with my phone in my hands.
Inglaterra;*ing_cyber *legenda_21;on a historic night that should have been about what women can do, not what they look like, singer Becky Hill was the victim of body_shaming trolls.⁠ i am also sorry you think that what i was wearing devalued my talent and wanted me to be more covered up to be a role model for body_confidence to young women. as you can read, that is an oxymoron, she said.⁠ Hill described her final show performance as one of the biggest moments of my career, adding that she will remember that moment until the day she die.⁠ it was an absolute honour to open up such an iconic and a historic moment for women in football, and perform in all my popstar glory.⁠
Inglaterra;*ing_cyber *legenda_22;as someone who is 5,8 i have experienced rejection from men due to my height plenty of times, I have in the past wished i was shorter so more men would see me as dating potential. i have never been particularly concerned about the height of men myself but when i have dated men a couple of inches shorter than me, i have noticed how odd people think it is. people make all kinds of judgements about relationships and the gender of people roles based on the height people. i have certainly found myself doing like princess Diana and trying to shrink myself around men who are shorter than me. my current boyfriend is the same height as me and i think it is great being able to see eye to eye with no neck straining. height preferences in dating is so common and so normalised, especially in heterosexual relationships, and like other preferences it is worth considering where it comes from: do you feel uncomfortablely big around men who are shorter than you, like you are taking up too much space or taking on a more masculine role? do you see taller men as being more masculine or more of a protector or more of a man? no one is forcing anyone to dating someone they do not want to, it is just always worth in life considering where your desires come from and if they are really as innate as we tend to think they are.
Inglaterra;*ing_cyber *legenda_23;it feels weird posting this because 32 really is not that old, but a 28 year old went viral on tiktok with a similar video where loads of teenagers were freaking out about ageing in the comments. when you are a woman, you are either too young or too old. you are expected to hate your skin, hate any changes, and hate any sign of ageing, even though ageing is an inevitable part of life. i have so many memories of women in my life telling me how lucky i have to have young skin and tearing themselves apart. i do not want to feel that way, i want to feel neutral and be able to enjoy and live my life, free from the fear that my skin might not fit a certain ideal. demonising ageing is one of the many ways the patriarchy keeps women in their place, the more wisdom and experience you gain, the less valuable and worthy you are. it divides women into categories and pushing them into living in fear of the passage of time. it pushes women to spend time, money, and energy agonising over their skin. women fear ageing for good reason. older women face economic and social discrimination. women who do not wear makeup face economic and social consequences. women who do not fit into the narrow ideals of patriarchy face discrimination and violence.
Inglaterra;*ing_cyber *legenda_24;one of my earliest baby feminist memories is being interrupted by my grandmother while playing and asked to go help with set up for dinner in the kitchen, when i pointed out that my older brother have not been asked, just me and my sisters, i was told to stop being difficult. you better believe i dragged my brother into that kitchen so fast. to his credit, he also realises how unfair that was and is raising his son different.
Inglaterra;*ing_cyber *legenda_25;i was working in a busy emergency department, when a man came in who was caring for his brother with learning difficulties. the man with learning difficulties was in a terrible state, and clearly had not been cared for properly as his clothes were soiled and he had dried faeces on his legs. i asked the brother to step out so i could complete personal care for the man, but he refused stating, he does not need privacy. i asked the man with learning difficulties if he was comfortable with his brother staying, and he said he was. i began to undress the man, and when i bent over to pick up a towel from the floor the brother said, you are giving me ideas, bending over like that. i have always had a thing for nurses. i told the man how inappropriate his comment was, but he still refused to leave the room. i continued with personal care, and although no further comments were made, i felt intimidated and frighted, and i could feel his eyes on me the whole time. i told a senior member of staff about the incident and they simply said, unfortunately it is just one of those things. it happened less than a year into being a qualified nurse.
Inglaterra;*ing_cyber *legenda_26;as a postwoman, i get catcalled and shouted at by workmen most days of my working week. some weeks it is every single day. it got to the point at the beginning of this year where i was having to fight off panic attacks whenever i was delivering to houses having work done. i would feel my gut twist as work vans past me, anticipating the shouts, leers and invasive comments about my body. last week a middle age man was parked across the driveway of a house i was delivering to, he leaned out of his window and said, girl, you need to stop moving so fast, your body is making me sweat. i avoided the house for the rest of the week. i felt embarrassed, uncomfortable, and in light of the recent news regarding Sarah Everard and the outpouring of stories from women who have experienced harassment and violence at the hands of men, i now feel scared and unsafe. i smile and carry on walking, even though smiling at them is the last thing i want to do. if i do not respond i get shouted at more, or laughed at, so smiling is just the easiest option. i am tired of being treated like this just for being a woman. like my male colleagues. i am literally just trying to work, trying to pay my bills.
Inglaterra;*ing_cyber *legenda_27;this morning i did an interview with lbc radio about the death of seduction stemming from the ban of the song baby it is cold outside. where i was repeatedly asked, how many times can a man ask a woman to stay over after her saying no. and the bottom line of the question being, can not men seduce women anymore? firstly, how many times do women need to say no before they are listened to? and honestly, if a woman really wanted to stay the night, you would not have to ask her 5 times. there is this myth that has been repeatedly told to us in films and music, which is if you ask a woman enough, eventually she will just give in and say yes. my question is this, how seductive is it really, if the woman is repeatedly saying no?
Inglaterra;*ing_cyber *legenda_28;speaking about the column written by Jeremy Clarkson, prince Harry said: what he said was horrific, and it is hurtful and cruel towards my wife, but it also encourages other people around the united_kingdom and around the world, men particularly, to think it is acceptable to treat women that way. to use the words of my stepmother, there is a global pandemic of violence_against_women. ⁠the sun said sorry, but what for? a spokesperson for Harry and Meghan said the statement was a public relations stunt and that the sun had not reached out to Meghan. the sun mentioned the strong response to Clarkson column, but made no mention of the actual impact of what he called a clumsy reference. it is difficult to take an apology as sincere when the body issuing it will not say exactly what it is for. ⁠how can we start to unpick the deeply woven culture of anger, hatred and violence towards women if we do not acknowledge the impact of these seemingly less serious moments? how can we make women feel safer when we let things slide? ⁠
Inglaterra;*ing_cyber *legenda_29;i have, in my time, attracted a fair few frenemies, both men and women. they have varied widely in terms of background and character, but the one common feature is that they made me feel being their friend was a precious and unparalleled gift,  the equivalent of the toxic partner who tells you that you will never find anyone who loves you like i do. it takes years of recovery to realise you will not, and that this is a good thing because the way they loved you was unhealthy and controlling and not a little narcissistic.
Inglaterra;*ing_cyber *legenda_30;running is a way for people to take control in a way they perhaps can not with their love life and careers. you are not relying on someone else, or something external. you can work towards a milestone, build a habit and see the fruits of your labour very quickly. running is booming among women in their 20s and 30s, and it is easy to see why. when traditional milestones like marriage, motherhood and property feel out of reach, signing up for a half marathon satisfies our need for achievement.
