País;Codigo Legenda;Texto
Inglaterra;*ing_cyber *legenda_31;many people will think to themselves well I would leave him if he spoke to me like that. but that is why love bombing is a key stage of the pattern of emotional abuse. love bombing is characterised by excessive attention, admiration, and affection with the goal to make the recipient feel dependent and obligated to that person. it is a manipulative_tactic. it makes you feel special, needed, loved, valuable, and worthy, which are all the components that contribute to and increase a persons self_esteem. in the love bomber stage, everything seems perfect. you have all the validation and affirmation you have ever wanted. but then, after the love bomber has gained your trust, the switch happens, and behaviour like this emerges. the conning,manipulation, and abuse begin. like a switch, this person who once made you feel like so good starts to belittle, control, and devalue you. and because you had a taste of how it could be in the love bombing stage, you are more willing to give them leeway and make excuses. you think well if I am just less annoying, he will return to the lovely man I first met. they do not return except temporarily, it only gets worse. victims of this behaviour will often feel very confused and mentally all over the place. this is by the perpetrators design. it is never your fault.
Inglaterra;*ing_cyber *legenda_32;there is typically an escalation in abusive_behaviours as the abusive_partner becomes comfortable with abuse, know they can push the boundaries and often as a considered response to increase or maintain control over the other person. many people dismiss acts like punching a wall as well I did not hurt anyone so it does not count or even well I did not hurt anyone so it is a good action because they see it as releasing their anger without punching a person. many people dismiss it as men just being out of control or even as a healthy expression of anger because boys will be boys. if someone genuinely can not help themselves from smashing stuff when they are angry, they need anger management therapy. punching a wall is violent and it is a huge red_flag, one you should run from. destroying your belongings shows a desire to hurt you. domestic_violence is born from small changes in already violent_acts. abusive words and threats escalate, smashing stuff escalates, pushing escalates, and punching escalates. femicide does not happen out of nowhere. smashing things is listed as a type of domestic_violence by the national domestic_violence hotline for a reason.
Inglaterra;*ing_cyber *legenda_33;in relationships, both partners should support the other to learn and grow, but too many men are entering adulthood and entering romantic_relationships without the basic skills needed for successful healthy_relationships. this fails men, and it fails the women who have to put in the labour, energy, and patience needed to make their relationship with this man that they love work. in times gone by, this dynamic was not challenged. women were told not to expect much emotional_support from their partners and to just be happy with that. after all, you did not have much choice. but now we expect relationships full of love and connections, we deserve those relationships, and for that to be possible, the skills of emotional intelligence, communication, empathy, and listening are needed. women who, from a young age, are expected to learn these skills, are more likely to enter into adult romantic_relationships already equipped with them, men are not. but these skills are not inherent, they can be learnt. men are perfectly capable of learning them themselves and not putting all that emotional_labour onto their current or future partners. because love only goes so far, women will not be sticking around to grow a man anymore. we expect them to be fully grown.
Inglaterra;*ing_cyber *legenda_34;as someone who was in a relationship with a man 10 years senior in my early 20s, much of this case for marrying an older man reads like a list of red_flag.the first one that really hit home, was the describing of an other half not as a partner, but as my mentor, lover, and in only certain contexts, my friend. when my relationship ended, something I had told myself throughout was that he was more of a mentor to me than a partner. the problem with this was, with a 10 year age, earnings and work experience gap, there was a huge power imbalance. yet one of the most obvious things in this article is the security and romance the author writes about does not come from an age gap, it comes from a wealth gap, which makes it read like a modern version of a 1950s housewife manual for finding a good husband.  I am aware we are in the midst of a cultural pivot back to traditional values, anti feminism, the stay_at_home girlfriend and tradwives. did these ever really leave? and I am not going to sit here and tell people to not marry rich or work, women should be able to do what they want. however there is a more pressing case to be made for looking out for signs of coercive, emotional and financial control. according to surviving economic abuse: 1 in 6 women in the united_kingdom experience financial_abuse in a current or former relationship. 95_percent of women who experience abuse report experiencing financial_abuse. more than half of women experiencing domestic_abuse said they had no money so could not leave. this is a grim reality for countless women and worth mentioning if we are having the marrying rich convo. I live in an apartment whose rent he pays and that shapes the freedom with which I can ever be angry with him. I am sure there are many benefits to marrying rich, but at what cost?  when the house of cards is built on youth, beauty and mentorship, what happens when we grow up, our bodies change, or we eventually want a career or financial_freedom? i fear this article does not make a case for marrying older, it makes a case for finding financial_independence and a partner who does not treat you like a pet.
Inglaterra;*ing_cyber *legenda_35;to celebrate valentines we want to reminisce over some of the worst toxic_relationship ideals we have been fed in films about how romance or acts of love are supposed to look. despite their sins, I do have a soft spot for basically all of these movies. but i think that is just my unshakable nostalgia. either way, rewatching them is a wild experience! this is very much a non exhaustive list so please add more and let us know what you think in the comments.
Inglaterra;*ing_cyber *legenda_36;he bludgeoned his heavily pregnant wife to death, but sure, he sounds like a gentle golden retriever kinda man. when will we stop glorifying and humanising men who murder their wives and entire families? it is entirely unhelpful, and feeds into already dangerously prominent myths about abusive_relationships and how they present.
Inglaterra;*ing_cyber *legenda_37;women are publicly and privately shamed on what feels like an hourly basis if they do not adhere to societal_expectations around motherhood. Sophie Turner and Joe Jonas have filed for divorce, and the conversations around this particular celebrity breakup have been harsh, shaming and undoubtedly sexist.
Inglaterra;*ing_cyber *legenda_38;more than half of working_mothers have experienced some form of discrimination, either during their pregnancy, maternity_leave or upon their return to the workplace.⁠ the charity, which aims to eradicate the motherhood penalty, teamed up with women in data to survey more than 24,000 parents, uncovering the workplace discrimination that women face after becoming mothers.⁠
Inglaterra;*ing_cyber *legenda_39;it is expected that women have some sort of instinctive desire to have children and somehow also know how to take care of them, regardless of needs, wants, or experience due to maternal_instinct. and while wanting to have children and take care of them is great, the idea that just because you are a woman you should instinctively know what to do with them is unrealistic and adds a whole lot of unnecessary anxiety and stress. on the flip side, it is expected that men will be useless with all children including their own and that they will not be the primary caregiver, that is why it is daddy daycare and I hope he will be ok left alone with the baby. it leads to men who exhibit any kind of child care skills being highly praised.
Inglaterra;*ing_cyber *legenda_40;well done Paige for rejecting the mother_role so many men put women into in relationships! the mother_role  is forced on women who have immature, lazy and or emotionally stunted male partners. within femininity motherly characteristics are put on a pedestal: tolerance, gentleness, caring, nurturing, sensitivity, nurturance, deference. these can be wonderful qualities but not when they enable men to take advance of women. mothers are always supposed to put everyone else first, they are not to be selfish or demanding or aggressive. women in this role are responsible for doing all the emotional_labour and often domestic_labour in heterosexual relationships, constantly working on things like communication and connectivity. reinforcing the idea that a good girlfriend or wife is one that constantly tries to fix a man is not only gross but harmful. it teaches women that it is their duty to not only accept male_behaviour that is unacceptable but to take on responsibility for it, responsibility that should be on the mans shoulders.
Inglaterra;*ing_cyber *legenda_41;more and more women are unsure if they want children or sure that they do not and some people just can not get their heads around it. so many people just assume that all women are desperate for child because is not that the whole point of women?! but it is more common for women to be unsure than men. a poll from 2013 found that more than 80_percent of men said they would always wanted to be a father or at least thought they would be someday. just 70_percent of women felt the same. is it any wonder when women are asked to sacrifice so much to be mothers? our health, our careers, our unpaid_labour. society does not support mothers, it would much rather shame women who choose to opt out.
Inglaterra;*ing_cyber *legenda_42;the campaign to get misogyny recognised as a hate_crime has been a long one, but now women in england and Wales are being asked to share their experiences of gender_based harassment, assault and abuse. by submitting your own stories, you could help shape future government policy on misogynistic hate_crime.
Inglaterra;*ing_cyber *legenda_43;Roe v Wade has been overturned. we are outraged and heartbroken for the women of usa. the supreme courts ruling is more than a life changing regression on reproductive_rights, it threatens the foundations of equality, the autonomy women have to make decisions about our own bodies and lives. abortion rights must be entrenched in law because abortion rights are human_rights. and today is ruling for women in the usa is a harsh snapshot of what many women around the world fear, and of course which many must already endure.
Inglaterra;*ing_cyber *legenda_44;many black and brown women will see their own experiences reflected in how women member of parliaments are treated, tone policed, silenced and spoken for. in the midst of dealing with racist comments from a conservative_party political donor, member of parliament Diane Abbott attended the questions of the prime minister today only to be ignored repeatedly by the speaker of the house while others debated her own experiences around her.⁠
Inglaterra;*ing_cyber *legenda_45;what does it mean to be a wife? women are just as capable as men of internalising patriarchal ideas about women and their role in relationships. in our society, the meaning of and history of marriage is so deeply rooted in patriarchy and gender_inequality, that when these women talk about being a wife they imagine it as a role that serves a husband through domestic_labour and sexual_labour, rather than as a partnership between two equals. the patriarchy tells women that they exist to serve others, that they must prove that they can do this by being hot, by doing unpaid domestic_labour, by being good at sex, even by getting an education, in order to be worthy of marriage and worthy of the role of wife.
Inglaterra;*ing_cyber *legenda_46;the patriarchical myth of men as protecters and providers is designed to keep women scared and compliant by pretending that they benefit from the patriarchy. but it is a narrative that refuses to accept the reality of male_violence_against_women, that it is mostly perpetrated by men close to women, in favour of stroking mens egos and fantasies about beating up foreign invaders to protect their property: their woman. anyone of any gender who wants to protect in a meaningful way should do so by working to deconstruct the white supremacy patriarchical structures that excuse, enable, and encourage violence against marginalised groups.
Inglaterra;*ing_cyber *legenda_47;women do not exist for men. that should be pretty simple to understand, yet not for some men. some men actually think women should shape themselves to their every desire, that we are not human beings with our own interests and hobbies. this kind of thinking can get in our heads if we are not careful, how many of us are guilty of changing our personalities to date someone you really like? of pouring yourself into someone until you are not sure who you are? it is nice to share interests with your partner but a man who thinks what you are interested in is silly or frivolous, nah. have you ever noticed that it is all hobbies that are dominated by women that are seen are silly and shallow? hobbies that are code as male, fishing, lifting weights, playing call of duty, watching sport, are seen as hobbies of importance, while hobbies that are code as female, practicing yoga, applying makeup, knitting, watching reality tv, are seen as inferior, some men do not even think women have hobbies. it is all part of the systematic devaluation of femininity, and a need of the patriarchy to keep women from discovering their own space and identity separate from men.
Inglaterra;*ing_cyber *legenda_48;one the largest conservative_party donors, Frank Hester made racist, violent and misogynistic comments about labour, member of parliament Dianne Abbot in 2019. while Hester claims they were rude, he completely failed to acknowledge the extreme, hateful misogynoir in these remarks. so what exactly is misogynoir? as you might know, misogyny is an extreme form of sexism, defined as the hatred of women. misogynoir is a term coined by the queer black feminist Moya Bailey in 2010, referring to a specific form of sexism, rooted in racism. the term blends concepts that combine misogyny and the french word for black, noir. the concept was also notably introduced by Sojourner Truth, who spoke out about misogynoir before the term was coined in her aint I a woman speech at the womens convention in 1851. There are plenty of ways that misogynoir manifests in real life and sadly, these absolutely vile and shameful comments from conservative_party donor Frank Hester are an example of exactly that.
Inglaterra;*ing_cyber *legenda_49;the conviction rates in this country speak alone to the fact that this government does not think rape is a crime. but literally not including it or harassment and stalking for that matter in the stats so you can announce a reduction in crime? madness!! it is no surprise a recent study from child protective service shows that half of 18 to 24 year olds are confused about consent, and believe that rape is only a crime if the victim fights back. the messaging from our government about gender_based violence has always been piss poor or non existent and now they are quite literally erasing sexual_assault as a crime to fit their narrative. this has to stop!!!! only slightly more depressing is the fact that x twitter fact checked this announcement from the conservative_party, to say that they had not included fraud and cyber crime in the report. so sexual_assault still does not register as a crime to anyone it seems. we need the government to fund mandatory education and awareness campaigns around this issue to counter the wave of misinformation young people face online. in the wake of the reach toxic_mens rights influencers have, we need to put up just as much of a fight to tackle it. we have an unbelievably high mountain of misinformation to climb still, this many years later. and I will not stop talking about it until everyone is paying attention.
Inglaterra;*ing_cyber *legenda_50;a terrifying new study from kings college has revealed that gen z boys and men are more likely than baby boomers to believe feminism is harmful, and a fifth of men aged 16 to 29 think favourably of Andrew Tate. feel like we are going backwards yet??? even scarier, a new survey from the child protective service has revealed half of young adults believe rape is only a crime if victims fight_back. the survey also reveals confusion around the legal definition of consent. all of these surveys show we have a huge problem with misogyny and misinformation in this country, that we can not ignore anymore. dangerous men with influence on social_media like Tate have been left unchecked to wreak havoc online for far too long and now the damage has been done. we are paying the price for what social_media companies and governments failed to do at the time, which was to stop this harmful rhetoric doing so much damage. thankfully there are organizations out there who are determined to undo the work of people like Tate. together we can combat this hate and misinformation, we can not sit back idly anymore.
Inglaterra;*ing_cyber *legenda_51;after a nude photo posted by motley crue drummer Tommy Lee was allowed to remain on instagram for hours, many of us are wondering why it seems like only womens bodies get censored on the app?⁠ photos of breastfeeding mothers with even the slightest sliver of areola showing are removed instantaneously. images of black curvy bodies are constantly shadow banned or taken down. testimonies of sexual_harassment and abuse are suppressed and censored, and sex_positive pages are warned that their accounts are going to be deleted all the time. but a full frontal image of a verified straight white man with over 1 million followers? yes, totally fine. no community guidelines breached there. and do you know why? because they were written by the very same men, says Eliza Hatch.
Inglaterra;*ing_cyber *legenda_52;for most of us, our homes are our havens. a safe_space away from the threat of coronavirus. but for thousands of women, being told to stay behind closed doors right now could not be more terrifying. we spoke to leading domestic_abuse charities about the women in danger during lockdown, and how we can help.if you want to access support over the phone at any time, the freephone, 24 hour national domestic_abuse helpline is 0808 2000 247. If you are in immediate danger, call 999. If you want to help someone who is struggling, the every day allyship is a new online platform by united nations which signposts services and advice to support women facing abuse during covid19 isolation.⁠⠀
Inglaterra;*ing_cyber *legenda_53;content warning.⁠ a metropolitan police officer has admitted to being a serial rapist who carried out more than 40 attacks against 12 women over the course of a 17 year period.⁠ David Carrick, 48, pleaded guilty at southwark crown court on monday to four counts of rape, false imprisonment and indecent assault relating to a 40 year old woman in 2003. it can now be reported that he had already pleaded guilty to a further 43 charges, including 20 counts of rape, in december.⁠ the scale of the offences committed by Carrick, who carried out many of his attacks during his time with the metropolitan police, makes him one of the worst sexual offenders in modern criminal history. ⁠
Inglaterra;*ing_cyber *legenda_54;men like this would probably claim that they would never hit a woman but they still want to have the power and control of an abuser in a relationship and they want to teach men how to have the same. they will, therefore, use imitation tactics like this to try and have power and control in a relationship. these kinds of videos are designed to teach men abuser tactics and very dangerous. men like this will use other abusive methods if these do not work or are not enough to maintain that power and control, emotional_abuse, financial_abuse, coercive_control, sexual_violence, and physical_violence. these kinds of men want to normalise these behaviours that endanger women.
Inglaterra;*ing_cyber *legenda_55;each year in parliament, member of parliament Jess Phillips reads out the names of women who have killed by men over the past 12 months. this year, it took more than five minutes to read out the 98 names. Jess Phillips has said she is tired that womens_safety matters so much less than small boats in parliament, why is it a near empty chamber? the united nations has said that their strategies for tackling violence_against_women and girls fall short of the level of binding legislation and are not rooted in human_rights language. every three days, a woman is killed by a man in the united_kingdom, and one in four women experience domestic_violence. those of us who fight for change, who hear these names every year, are tired and sick of it getting worse due to austerity and lack of government action.
Inglaterra;*ing_cyber *legenda_56;many of you might remember that I attended a married at first sight event hosted by the show where, during the questions and answers, I called out Brads behaviour and asked them why they continued to put abusers on the show, I mention George from last season too. I was shut down with they are maybe moving too fast. we saw it for what it was. one of my aims is to make the world a lot less comfortable for abusers, while also showing that they are not evil monsters, they are people we know. I want to give people the tools needed to call out this behaviour, to call it unacceptable. many people, either due to their own experiences or knowledge, are able to identify emotional_ abuse when they see it. that does not mean it is easy to escape abusive_relationships or save your friends from abusive_relationships or identify the abusers in your life, but it can be a tool in your arsenal. some abusers are far more open, others are much better at playing the nice guy, but I want people to be able to see their friends being treat like Shona and understand the need for a girls night where they ask her if she is ok and needs any support. to have a mate like Brad and to understand the need to tell him that you will not stand for his behaviour and explain why. people in relationships deserve basic respect. no one should think that belittling and manipulation is something that someone who loves you will do. love bombing is a manipulative tactic designed to make the victim think later on that it will get better, if I just change in the way he wants me to, he will love me again. it will not get better, you deserve better, seek support to help you leave.
Inglaterra;*ing_cyber *legenda_57;did you know the majority of incidents of harassment on public transport happen between 5 to 6pm during rush hour? this is an incredibly important piece of research that has just been published by the bbc, as it completely busts the myth that harassment happens when you are alone, or travelling in the middle of the night in an empty carriage. these are the kind of myths that often perpetuate victim_blaming narratives and do not lead us towards useful solutions to tackle the problem. we know that harassment can happen at any time, in any place of course, however it is imperative that we dispel these misconceptions once and for all so we can create better systems of prevention and supporting survivors. thanks bbc news for having me and my hot take on this new piece of research around the rise in reporting incidents of sexual_harassment on public transport. if you are travelling, and you witness an incident. doing something is better than nothing, we need all commuters to engage and become active_bystanders to we can tackle this problem together once and for all.
Inglaterra;*ing_cyber *legenda_58;make bystander_intervention education mandatory!! there needs to be a mass education program of bystander_intervention to people of all ages and backgrounds in this country and across the world. I am absolutely horrified and appalled that a woman could be raped in broad daylight, in rush hour, in front of witnesses on the tube. disgusted does not even cover how I feel right now. we already know that there is a huge lack of bystander_intervention when it comes to sexual_harassment and assault in public. but how, how could this happen? how is there still no closed circuit television inside tube carriages and did anyone try to stop it? there is no doubt it would have been an absolutely terrifying ordeal for the french national and their child to witness. but surely, surely something could have been done to stop this happening? I do not want to put blame on the bystander. the blame lies with the perpetrator alone, however there are systems in play that regularly contribute to harm against women and marginalised genders. why was not this man apprehended after exposing himself, masturbating and chasing two women earlier that same morning?
