termo,linha,before,keyword,after,texto_original,pais,idioma
corpo,69,próprio vida cuido de o meu,corpo,seleciono meu pensamento escolher o,"Preciso de mim como nunca precisei. Cheguei a uma fase da minha vida que aos olhos do mundo pareço não dar valor ao que me rodeia nem ao que devia constituir preocupação. A postura afeminada, um tom de voz mais baixo, um andar mais cauteloso, livros menos radicais, amizades comportadas, ter os pés no chão, e etc. Recentemente, estranhei a ausência de lágrimas ao sair de uma relação amorosa onde tanto me dediquei, amei e fiz planos. Namoro terminou e no dia seguinte segui sorrindo, leve e solta e com uma vaga para o próximo. Já não me importo com o que vão pensar ao me verem descalça a caminhar na estrada. Na verdade, o lugar da minha mente onde armazenava o peso na consciência tende a reduzir. Para mim, desde que não faça mal ao outro, a liberdade é ainda um campo virgem por se experimentar. Cheguei a esta fase onde quando as lágrimas me invadem permito que elas beijem meu rosto, me permito sentir dor e chorar, gritar e abraçar.Distribuo elogios aos rostos que me transmitem energias positivas, colho flores na rua, ajudo pessoas a atravessar, converso com a senhora das badjias, em fim, os meus dias são sim finalmente poesia. E ainda bem que estou assim e aqui. Preciso de mim como nunca precisei e este exercício de me pertencer e ser inteiramente minha tem evoluído todos os dias. Tenho um check_list de auto cuidado e sigo este ritual diário de amor próprio de forma minuciosa, tirando os dias da ressaca, claro! Estou numa relação tão intensa, tão saudável e tão madura e responsável comigo mesma, tenho realizado o que desejei que pudesse ser um amor dado, fazendo de mim o amor da minha própria vida. Cuido do meu corpo, seleciono meus pensamentos, escolho o que dar valor,me  dou prazer e por vezes escolho amar o outro sem que este amor signifique tirar um pouco de mim. Estou egoísta sim e tenho me amado, ligado pra mim mesma, saído sozinha pra apreciar o sol, tomado cerveja no quarto e rido dos meus tombos, tenho lido tudo e todos. Tenho rezado, me encontrado e construído a cada dia as mulheres que fui, as mulheres que sou e os seres humanos que hão de vir de mim.",,Portugues
corpo,3,violento ter estar a ganhar,corpo,incluindo em o discurso de o rede,"Sabias que no primeiro trimestre de 2023 foram reportados um total de 2.903 casos de violência_doméstica, dos quais, 86 casos foram contra crianças (52 raparigas e 34 rapazes), 2.691 contra adultos (2.258 mulheres e 433 homens) e 126 contra Idosos (74 mulheres e 52 homens), equivalentes a 3 porcento, 92.7 porcento e 4.3 porcento, respectivamente. Espelhando apenas uma pequena porção dos casos tramitados pelo Departamento de Atendimento às Vítimas de Violência, estes dados espelham o quão a mulher continua a maior vítima representando 86.2 porcento das vítimas entre adultos. Apesar da aprovação da lei 29/2009 de 29 de Setembro e da criação do Mecanismo Multissectorialde Atendimento à Mulher Vítima de Violência em 2012, o extremismo violento têm estado a ganhar corpo incluindo nos discursos das redes sociais e as mulheres tendem a ser novamente culpabilizadas pela violência que sofrem. (Fonte. DAFMVV 2023)",,Portugues
corpo,94,e condenar este chacina meu,corpo,que dever ser templo de,"Eu era apenas um bebé, Que o leite materno do peito e do biberão. Foi bruscamente trocado pelo sémen. O que era quente e doce, afago e alento, Continua quente, mas agora tenebroso e violento. Eu era apenas um bebé, Mas minha primeira inspiração se misturou ao ar, Uma estranha quietude tomou conta dos kulungwanas. Minha chegada não foi motivo de celebração, Pois não carregava um pénis entre as pernas. E foi então que fui brindada com algemas, E minha triste sentença foi proferida: Condenada à morte desde o meu primeiro choro, Tudo pelo simples fato de ter nascido mulher. Eu era apenas um bebé, A vida que mal havia começado me conhecer, Já estava marcada por destino sombrio e sujo. Eu era apenas um bebé, Mas quem ousaria contestar a sentença de nascer mulher? Quem estaria disposto a ser a arma e condenar esta chacina? Meu corpo, Que deveria ser templo de inocência e descoberta, Foi tomado como propriedade por um, dois ou mais seres rijos. Trocam minha chucha e canções de ninar, Por tapas no rabinho encharcado de diarreia. Eu era apenas um bebé, Meu rebolado de ossos frágeis.Agora suporte para desejos de homens (grandes) Ou de grandes homens que preferiam eleger o silêncio. Eu era apenas um bebé, A inocência se dissolve, O amargo tomou os paladares, Apesar de cobardes, Pois nunca dirão que eu era apenas um bebé. Quantas mais fraldas terão de ser destruída para engrandecer a virilidade dos homens?",,Portugues
corpo,23,proteção corpo tombado/ prazer desperdiçar,corpo,castigar e desapontado/ eis o,"Numa noite crua e nua decidiste te deitar/ Debaixo da lua sobre as nuvens Despiste o corpo, libertaste a alma para um belo desposar/ Sem proteção, corpo tombado/ Prazer desperdiçado, corpo castigado e desapontado/ Eis o mês do Amor, cuide de si e da sua saúde./ Um momento de prazer sem proteção pode te custar a vida! Se proteja./ De: Aissa Abdul Karimo",,Portugues
corpo,53,para continuar a abusar de o,corpo,de o mulher isso ser violência,"Não é a saia que é curta, não é por causa da hora. Não é por causa da bebida que ela consumiu, nem da hora que ela regressou a casa. Essas são desculpas que usam para continuar a abusar do corpo das mulheres. Isso é violência, é machismo, é patriarcado e deve ser denunciado. Violência contra as mulheres e raparigas não têm desculpa, tem lei. Seguiremos_Em_Marcha_Ate_Que_Todas_Sejamos_Livres.",,Portugues
corpo,21,a o inúmero vez que seu,corpo,exalar embriaguez e sem nenhum,"Me pediu perdão mas como eu vou esquecer que ele levantou a mão?/   Como apagar as noites onde seu lado da cama não me esquentava,  às inúmeras vezes que seu corpo exalava embriaguez e sem nenhuma sensatez entrava por aquela porta!/ Olha! Faz tempo que não ti vejo aqui/ É sim, minha mãe pode ter perdoado mas eu não esqueço do pedaço de vidro que a levaria para longe mim. / E, olha minha mente tem desenhado situações onde ela morria, eu ia junto e você sorria./ E talvez ela até já tenha pensado ir se jogar do terraço enquanto você andava em amassos. / Haaa podridão da terra, levantou a mão devia partir desta para pior sim.",,Portugues
corpo,15,"adeus,/ quando se ir em",corpo,seu alma ficar em o lembrar,"Mãe Áfricana/Ela não tem medo do que há de vir a acontecer amanhã;/ Ela acredita que pode não mais partir de manhã/ Mas mesmo assim, ela prepara suas forças e amamenta seu ninho/ Numa noite de guerra, sem carinho./ Das vezes que precisa chorar, ela não tem medo de chorar/ As mães de África aprenderam logo cedo que chorar é respirar a alma./ Os olhos precisam dizer o que nos mata e acalma/ As mães de África aprenderam também a moer as incertezas para as cozinha na panela da vitória./ Mãe Áfricana não sabe dizer adeus,/ Quando se vai em corpo, sua alma fica nos lembrando das suas lutas armadas./ Uma mulher africana é uma flor eternamente amada/ Em África, não se abandona as pessoas, Um dia precisamos delas!/ Quando se pode declarar uma vitória tão sólida sem as mulheres? / As mulheres não mentem/ Quando dizem que conseguem,/ Coragem de gerar, nenhum homem tem!/ Uma mulher corajosa é africana/ África dos nossos ancestrais/ África nossa também!/ Lizete Sitoe",,Portugues
corpo,104,parte mais sagrado de o meu,corpo,responsável por gerar e gerir,"Cheguei triunfalmente portando uma mala com algumas roupas, depois de ter escolhido a dedo as melhores sedas para ocultar meus mamilos e me proteger do frio. A minha calcinha mais confortável protegia a parte mais sagrada do meu corpo, responsável por gerar e gerir outras vidas. E foi então que cheguei. Caminhava ao som dos murmúrios das pessoas ao meu redor, olhares tão frios e espantados. Os dedos apontados distantes e algumas mãos tapavam o rosto das crianças, impedindo eas de testemunhar aquele sacrilégio. Que serão aqueles casulos cobrindo o brilho daquela mulher? perguntavam espantados, numa aura de perplexidade. E do meu lado, não era fácil lidar com tantos olhares julgadores que me fitavam como se fossem juízes. Travei meus passos para buscar ar. Inspirei e expirei. Uma das crianças rebeldes veio correndo e puxou meu cachecol, e foi então que percebi que o problema eram os tecidos. Por que estranham esses tecidos se cobrem minha riqueza? Me questionava, com a voz da razão em minha cabeça. Como não esconder as mathunas sob a Capulana e como andar livremente, com o vento a estimular minhas entranhas? E foi então que as pessoas começaram timidamente a se aproximar de mim. As mulheres, com suas armas afiadas, e os homens ocupavam a rua à minha frente e me seguraram. As mulheres desferiram sobre minha roupa golpes com fúria incontida. Uma espada atingiu minha blusa, fazendo tombar. Uma enxada arrancou meu lenço, tirando partes dos cabelos. Uma forte rajada de mãos disputou meus tecidos com avidez até que, enfim, fiquei como mandavam as regras: Nua.",,Portugues
corpo,23,um belo desposar/ sem proteção,corpo,tombado/ prazer desperdiçar corpo castigar,"Numa noite crua e nua decidiste te deitar/ Debaixo da lua sobre as nuvens Despiste o corpo, libertaste a alma para um belo desposar/ Sem proteção, corpo tombado/ Prazer desperdiçado, corpo castigado e desapontado/ Eis o mês do Amor, cuide de si e da sua saúde./ Um momento de prazer sem proteção pode te custar a vida! Se proteja./ De: Aissa Abdul Karimo",,Portugues
